en;nl;fr;de;sv;pl;no;es;it;pt;lv;lt
Quantity;Aantal;Quantité;Menge;Antal;Ilość;Antall;Cantidad;Quantità;Quantidade;Daudzums;Kiekis
Discount (%);Korting (%);Remise (%);Rabatt (%);Rabatt (%);Rabat (%);Rabatt (%);Descuento (%);Sconto (%);Desconto (%);Atlaide (%);Nuolaida (%)
VAT;BTW;TVA;MwSt.;Moms;VAT;MVA;IVA;IVA;IVA;PVN;PVM
No.;Nr.;N°;Nr.;Nr.;Nr.;Nr.;Núm.;N.;N.;Nr.;Nr.
Sales prices;Verkoopprijzen;Prix de vente;Verkaufspreise;Försäljningspriser;Ceny sprzedaży;Salgspriser;Precios de venta;Prezzi di vendita;Preços de venda;Pārdošanas cenas;Pardavimo kainos
Cost prices;Inkoopprijzen;Prix d'achat;Einkaufspreise;Inköpspriser;Ceny zakupu;Kostpriser;Precios de coste;Prezzi di costo;Preços de custo;Iepirkuma cenas;Pirkimo kainos
Group purchase price;Groep inkoopprijs;Prix d'achat de groupe;Gruppen-Einkaufspreis;Gruppinköpspris;Cena zakupu grupowego;Gruppe innkjøpspris;Precio de compra de grupo;Prezzo di acquisto di gruppo;Preço de compra em grupo;Grupas iepirkuma cena;Grupės pirkimo kaina
Group profit margin;Groep winstmarge;Marge bénéficiaire de groupe;Gruppen-Gewinnspanne;Gruppmarginal;Marża zysku grupy;Gruppe fortjenestemargin;Margen de beneficio de grupo;Margine di profitto di gruppo;Margem de lucro do grupo;Grupas peļņas marža;Grupės pelno marža
State;Provincie;Région;Bundesland;Land;Kraj;Land;Estado;Stato;Estado;Valsts;Būsena
Archive quotations after publishing;Offertes archiveren na publicatie;Archiver les devis après leur publication;Angebot nach Veröffentlichung archivieren;Arkivera offerter efter offentliggörandet.;Archiwizuj ofertę po opublikowaniu;Tilbudet arkiveres etter publisering;Archivar citas después de publicar;Archiviare le citazioni dopo la pubblicazione;Arquivar citações após a publicação;Arhīva piedāvājums pēc publicēšanas;Archyvo pasiūlymas po leidybos
Quotations that are created with a previous published version will get the status 'Archived' and can no longer be edited.;Offertes die zijn gemaakt met een eerder gepubliceerde versie van het configuratiemodel krijgen de status 'Gearchiveerd' en kunnen niet meer worden bewerkt.;"Les offres créées à partir d'une version publiée précédente obtiennent le statut """"Archivé"""" et ne peuvent plus être modifiées.";Angebote, die mit einer älteren veröffentlichten Version des Konfigurationsmodells erstellt wurden, erhalten den Status 'Archiviert' und können nicht mehr bearbeitet werden.;"Tidigare offentliggjorda offerter kommer att få statusen """"Arkiverad"""" och kan inte längre redigeras.";Oferty utworzone za pomocą poprzedniej wersji otrzymają status „Zarchiwizowane” i nie będzie można ich już edytować.;Tilbud som er opprettet med en tidligere publisert versjon vil få statusen 'Arkivert' og kan ikke lenger redigeres.;Las cotizaciones que se crean con una versión publicada anterior obtendrán el estado 'Archivado' y ya no se podrán editar.;"Le citazioni create con una versione precedentemente pubblicata avranno lo stato ""Archiviato"" e non potranno più essere modificate.";As citações criadas com uma versão publicada anteriormente receberão o status 'Arquivadas' e não poderão mais ser editadas.;Piedāvājumi, kas izveidoti ar iepriekšējo publicēto versiju, iegūs statusu “arhivēts”, un tos vairs nevar rediģēt.;Pasiūlymai, sukurti naudojant ankstesnę paskelbtą versiją, gaus būseną „archyvuota“ ir nebegali būti redaguoti.
Note: copying and revising archived quotations may cause broken configurations. Please use the configuration code if you want to use the same configuration that is placed in an archived quotation.;Opmerking: Het kopiëren en bewerken van gearchiveerde offertes kan leiden tot gebroken configuraties. Om dezelfde configuratie uit een gearchiveerde offerte te gebruiken, gebruikt de configuratiecode.;Remarque : la copie et la révision des devis archivées peuvent entraîner la rupture des configurations. Veuillez utiliser le code de configuration si vous souhaitez utiliser la même configuration que celle placée dans un devis archivé.;Hinweis: Das Kopieren und Bearbeiten von archivierten Angeboten kann zu fehlerhaften Konfigurationen führen. Um die gleiche Konfiguration aus einem archivierten Angebot zu verwenden, verwenden Sie bitte den Konfigurationscode.;Obs: kopiering och revidering av arkiverade offerter kan leda till att konfigurationen inte längre fungerar. Använd konfigurationskoden om du vill behålla samma konfiguration som finns i en arkiverad offert.;Uwaga: kopiowanie i poprawianie zarchiwizowanych ofert może spowodować uszkodzenie konfiguracji. Użyj kodu konfiguracji, jeśli chcesz użyć tej samej konfiguracji, która jest umieszczona w zarchiwizowanej ofercie.;Merk: Kopiering og revidering av arkiverte tilbud kan føre til ødelagte konfigurasjoner. Bruk konfigurasjonskoden hvis du vil bruke den samme konfigurasjonen som finnes i et arkivert tilbud.;Nota: copiar y revisar cotizaciones archivadas puede causar configuraciones rotas. Utilice el código de configuración si desea utilizar la misma configuración que se coloca en una cotización archivada.;Nota: copiare e revisionare le citazioni archiviate potrebbe causare configurazioni non funzionanti. Si prega di utilizzare il codice di configurazione se si desidera utilizzare la stessa configurazione presente in una citazione archiviata.;Nota: copiar e revisar cotações arquivadas pode causar falhas nas configurações. Por favor, use o código de configuração se desejar usar a mesma configuração colocada em uma cotação arquivada.;Piezīme: Arhivētu piedāvājumu kopēšana un pārskatīšana var izraisīt salauztas konfigurācijas. Lūdzu, izmantojiet konfigurācijas kodu, ja vēlaties izmantot to pašu konfigurāciju, kas ievietota arhivētā piedāvājumā.;Pastaba: kopijavimas ir archyvuotų pasiūlymų peržiūra gali sukelti sugedusias konfigūracijas. Naudokite konfigūracijos kodą, jei norite naudoti tą pačią konfigūraciją, kuri įdedama į archyvuotą pasiūlymą.
Default status for archiving quotations;Standaardstatus voor het archiveren van offertes;Statut par défaut pour les devis archivés;Standardstatus für das Archivieren von Angeboten;Standardstatus vid arkivering av offerter.;Domyślny status archiwizacji ofert;Standard status for arkivering av tilbud;Estado predeterminado para archivar cotizaciones;Stato predefinito per l'archiviazione delle citazioni;Status padrão para arquivamento de cotações;Noklusējuma statuss arhivēšanas piedāvājumiem;Numatytoji archyvavimo pasiūlymų būsena
Default status for revised quotations;Standaardstatus voor herziene offertes;Statut par défaut pour les devis révisés;Standardstatus für überarbeitete Angebote;Standardstatus vid revidering av offerter.;Stan domyślny dla poprawionych ofert;Standard status for reviderte tilbud;Estado predeterminado para cotizaciones revisadas;Stato predefinito per le citazioni revisionate;Status padrão para cotações revisadas;Pārskatīto piedāvājumu noklusējuma statuss;Numatytoji pataisytų pasiūlymų būsena
Default status for expired quotations;Standaardstatus voor verlopen offertes;Statut par défaut des offres expirées;Standardstatus für abgelaufene Angebote;Standardstatus på förfallna offerter.;Stan domyślny dla wygasłych ofert;Standard status for utlpte tilbud;Estado predeterminado para cotizaciones vencidas;Stato predefinito per le citazioni scadute;Status padrão para cotações expiradas;Noklusējuma statuss piedāvājumiem, kuriem beidzies derīguma termiņš;Numatytoji pasiūlymų būsena
Default CRM account;Standaard CRM account;Compte CRM par défaut;Standard CRM Account;Standard CRM-konto.;Domyślne konto CRM;Standard CRM-konto;Cuenta CRM predeterminada;Account CRM predefinito;Conta CRM padrão;Noklusējuma CRM konts;Numatytoji CRM paskyra
Select a default CRM that is automatically set in the quotation as the seller field.;Selecteer een standaard CRM account die automatisch wordt toegewezen als de verkoper in de offerte.;Sélectionnez un CRM par défaut qui est automatiquement défini dans les devis comme champ du vendeur.;Wählen Sie einen Standard-CRM-Account, der automatisch als Verkäufer im Angebot eingetragen wird.;Välj ett standard CRM som automatiskt ställs in som säljare i offerten.;Wybierz domyślny CRM, który jest automatycznie ustawiany w ofercie jako pole sprzedawcy.;Velg en standard CRM som automatisk angis som selgerfelt i tilbudet.;Seleccione un CRM predeterminado que se establezca automáticamente en la cotización como el campo del vendedor.;Seleziona un CRM predefinito che verrà automaticamente impostato nella citazione come campo del venditore.;Selecione um CRM padrão que seja definido automaticamente na cotação como campo do vendedor.;Atlasiet noklusējuma CRM, kas tiek automātiski iestatīts piedāvājumā kā pārdevēja lauks.;Pasirinkite numatytąjį CRM, kuris automatiškai nustatomas pasiūlyme kaip pardavėjo laukas.
Hide total quotation discount field;Verberg totale offertekorting veld;Masquer le champ de remise totale de l'devis;Blende Schirmfeld des Gesamtangebotsrabatt aus;Dölj totalrabattfältet i offerten.;Ukryj pole rabatu dla oferty;Skjul feltet for den totalrabatten i tilbudet;Ocultar campo de descuento de cotización total;Nascondi campo sconto totale della citazione;Ocultar campo de desconto total da cotação;Slēpt kopējo piedāvājuma atlaižu lauku;Slėpti bendrą pasiūlymo nuolaidų lauką
Enable this if you want to hide the total discount field on the quotations screen.;Schakel dit in als u het totale korting veld op het offertepagina wilt verbergen.;Activez cette option si vous souhaitez masquer le champ de la remise totale sur les pages des devis;Aktivieren Sie dies, wenn Sie das Gesamtrabattfeld auf der Angebotsseite ausblenden möchten;Slå på den här fliken om du vill dölja totalrabattfältet i offerten.;Włącz tę opcję, jeśli chcesz ukryć pole całkowitego rabatu na ekranie oferty.;Slå på dette feltet om du vil skjule totalrabatten i tilbudet.;Habilite esto si desea ocultar el campo de descuento total en la pantalla de cotizaciones.;Abilita questa opzione se desideri nascondere il campo sconto totale sulla schermata delle citazioni.;Habilite esta opção se desejar ocultar o campo de desconto total na tela de cotações.;Iespējojiet to, ja vēlaties paslēpt kopējo atlaižu lauku ekrānā.;Įgalinkite tai, jei norite paslėpti bendrą nuolaidos lauką pasiūlymų ekrane.
Hide quotation margin columns;Verberg kolommen met offertemarge;Masquer les colonnes de marge des devis;Spalten mit Angebotsmarge verbergen;Dölj marginalkolumn i offerten.;Ukryj kolumny marży oferty;Skjule kolonnene for tilbudsmarger;Ocultar columnas de margen de cotización;Nascondi colonne margine citazione;Ocultar colunas de margem de cotação;Slēpt Piedāvājuma malas kolonnas;Slėpti pasiūlymo maržos stulpelius
Enable this if you want to hide the margin columns in the Quotation lines table. (By default margin columns are hidden behind the chevron button in the far right of the table.);Schakel deze optie in als je de margekolommen in de Offerte-regels tabel wilt verbergen. (Standaard zijn de margekolommen verborgen achter de chevron-knop aan de rechterkant van de tabel.);Activez cette option si vous souhaitez masquer les colonnes de marge dans le tableau des lignes de devis. (Par défaut, les colonnes de marge sont masquées derrière le bouton en forme de chevron à l'extrême droite du tableau).;Aktiviere diese Option, um die Spalte mit den Margin in der Angebotspositionen-Tabelle zu verbergen. (Standardmäßig sind die Margenkolonnen hinter der Chevron-Schaltfläche ganz rechts in der Tabelle verborgen.;Slå på knappen om du vill dölja marginalkolumnerna i tabellen Offertlinjer. (Som standard döljs marginalkolumnerna bakom chevron knappen längst till höger i tabellen).;Włącz tę opcję, jeśli chcesz ukryć kolumny marży w tabeli Oferty. (Domyślnie kolumny marży są ukryte za przyciskiem w kształcie jodełki po prawej stronie tabeli).;Aktiver dette hvis du vil skjule margkolonnene i Tilbudslinjer-tabellen. (Standard margkolonnene er skjult bak chevron-knapp helt til høyre i tabellen.);Habilite esto si desea ocultar las columnas de margen en la tabla Líneas de cotización. (De forma predeterminada, las columnas de margen están ocultas detrás del botón de cheurón en el extremo derecho de la tabla).;Abilita questa opzione se desideri nascondere le colonne del margine nella tabella delle linee di citazione. (Di default, le colonne del margine sono nascoste dietro il pulsante a forma di freccia nella parte destra della tabella.);Ative esta opção se desejar ocultar as colunas de margem na tabela Linhas de cotação. (Por padrão, as colunas de margem ficam ocultas atrás do botão de divisa na extremidade direita da tabela.);Iespējot to, ja vēlaties paslēpt malas kolonnas Piedāvājuma līniju tabulā. (Pēc noklusējuma malas kolonnas ir paslēptas aiz Chevron pogas tabulas labajā pusē.);Įgalinkite tai, jei norite paslėpti maržos stulpelius „Pasiūlymo linijų“ lentelėje. (Pagal numatytuosius paraštės stulpelius paslėptos už „Chevron“ mygtuko, esančio dešiniajame stalo dešinėje.)
Enable this if you want to be able to change the amount of each quotation group.;Zet dit aan als je het aantal van elke offertegroep wilt kunnen aanpassen.;Activez cette option si vous souhaitez pouvoir modifier le montant de chaque groupe de devis.;Aktivieren Sie diese Einstellung, wenn Sie die Möglichkeit haben möchten, den Betrag für jede Angebotsgruppe anzupassen.;Slå på knappen om du vill ändra beloppet för varje offertgrupp.;Włącz tę opcję, jeśli chcesz mieć możliwość zmiany kwoty każdej grupy ofert.;Aktiver dette hvis du vil kunne endre beløpet for hver tilbudsgruppe.;Habilite esto si desea poder cambiar la cantidad de cada grupo de cotización.;Abilita questa opzione se desideri essere in grado di modificare l'importo di ciascun gruppo di citazioni.;Ative esta opção se quiser alterar o valor de cada grupo de cotação.;Iespējot to, ja vēlaties mainīt katras piedāvājuma grupas summu.;Įgalinkite tai, jei norite pakeisti kiekvienos pasiūlymo grupės sumą.
Quotation group multiplier;Quotation group multiplier;Multiplicateur de groupe de cotation;Quotation group multiplier;Multiplikatoreffekt för offertgruppen;Mnożnik grupy Oferty;Multiplikator for tilbudsgruppe;Multiplicador de grupo de cotización;Moltiplicatore di gruppo di citazioni;Multiplicador de grupo de cotação;Grupas reizinātājs piedāvājumiem;Grupinis pasiūlymų daugiklis
Edit presets;Voorinstellingen bewerken;Modifier les préréglages;Voreinstellungen bearbeiten;Anpassa tabellförinställningar.;Edytuj ustawienia wstępne;Redigere forhåndsinnstillinger;Editar ajustes preestablecidos;Modifica le impostazioni predefinite;Editar predefinições;Rediģēt sākotnējos iestatījumus;Redaguoti išankstinius nustatymus
Choose at which level table presets are allowed to be configured;Kies op welk niveau tabelinstellingen mogen worden geconfigureerd;Choisissez à quel niveau les préréglages du tableau sont autorisés à être configurés;Wählen Sie, auf welcher Ebene Tabellenvoreinstellungen konfiguriert werden dürfen;Välj på vilken nivå förinställningar för tabeller får konfigureras.;Wybierz, na jakim poziomie ustawienia wstępne tabeli mogą być konfigurowane;Velge på hvilket nivå tabellforhåndsinnstillinger som kan konfigureres;Elija en qué nivel se pueden configurar los ajustes preestablecidos de la tabla;Scegli a quale livello è consentito configurare le impostazioni predefinite della tabella;Escolha em qual nível as predefinições de tabela podem ser configuradas;Izvēlieties, kurā līmeņa tabulā ir atļauts konfigurēt;Pasirinkite, kuriuose lygio lentelės išankstiniuose nustatymuose leidžiama sukonfigūruoti
Original name:;Oorspronkelijke naam:;Nom original :;Originaler Name:;Ursprungligt namn:;Oryginalna nazwa:;Opprinnelig navn:;Nombre original:;Nome originale:;Nome original:;Sākotnējais nosaukums:;Originalus vardas:
Edit table preferences;Bewerk tabelinstellingen;Modifier les préférences de la table;Tabelleneinstellungen bearbeiten;Redigera tabellinställningar;Edytuj preferencje tabeli;Redigere tabellinnstillinger;Editar preferencias de mesa;Modifica preferenze tabella;Editar preferências de tabela;Rediģēt tabulas preferences;Redaguoti lentelės nuostatas
Add column;Kolom toevoegen;Ajouter une colonne;Spalte hinzufügen;Lägg till kolumn;Dodaj kolumnę;Legg til kolonne;Añadir columna;Aggiungi colonna;Adicionar coluna;Pievienot kolonnu;Pridėkite stulpelį
Use this to permanently remove this preference preset.;Gebruik dit om deze voorkeursinstelling permanent te verwijderen.;Utilisez cette option pour supprimer définitivement cette préférence prédéfinie.;Hiermit können Sie diese Voreinstellung dauerhaft entfernen.;Använd den här funktionen för att permanent ta bort den här inställningen.;Użyj tego, aby trwale usunąć to ustawienie wstępne preferencji.;Bruk denne til å fjerne denne forhåndsinnstillingen permanent.;Utilícelo para eliminar de forma permanente este ajuste preestablecido de preferencia.;Usa questa opzione per rimuovere definitivamente questa impostazione predefinita.;Use isto para remover permanentemente esta predefinição de preferência.;Izmantojiet to, lai neatgriezeniski noņemtu šo preferences iestatījumu.;Naudokite tai visam laikui pašalinti šį pasirinkimo nustatymą.
Delete preference;Voorkeur verwijderen;Supprimer la préférence;Präferenz löschen;Ta bort inställningar;Usuń preferencję;Slett innstilling;Eliminar preferencia;Elimina preferenza;Excluir preferência;Dzēst preferenci;Ištrinti pirmenybę
Add filter;Filter toevoegen;Ajouter un filtre;Filter hinzufügen;Lägg till filter;Dodaj filtr;Legg til filter;Añadir filtro;Aggiungi filtro;Adicionar filtro;Pievienot filtru;Pridėti filtrą
FALSE;FALSE;FAUX;FALSE;FELAKTIGT;Błąd;USANN;FALSO;FALSO;FALSO;Nē;NE
TRUE;TRUE;VRAI;TRUE;SANT;Prawda;SANN;CIERTO;VERO;VERDADEIRO;Jā;TAIP
VAT number;btw nummer;Numéro de TVA;Umsatzsteuer Identifikationsnummer (USt-ID);Momsnummer;Numer VAT;MVA-nummer;Número de valor agregado;Partita IVA;CNPJ;PVN numurs;PVM numeris
Configuration model is locked;Configuratiemodel is geblokkeerd;Le modèle de configuration est verrouillé;Konfigurationsmodell ist gesperrt;Konfigurationsmodellen är låst;Konfiguracja modelu jest zablokowana;Konfigurasjonsmodellen er låst;El modelo de configuración está bloqueado;Il modello di configurazione è bloccato;O modelo de configuração está bloqueado;Konfigurācijas modelis ir bloķēts;Konfigūracijos modelis užrakintas
The current configuration model is locked and the desired action cannot be executed. Please contact your system administrator if you want to execute the desired action.;Het configuratiemodel is geblokkeerd en de gewenste actie kan niet worden uitgevoerd. Neem contact op met je admin om de gewenste actie uit te voeren.;Le modèle de configuration actuel est verrouillé et l'action souhaitée ne peut pas être exécutée. Veuillez contacter votre administrateur système si vous souhaitez exécuter l'action souhaitée.;Das aktuelle Konfigurationsmodell ist gesperrt und die gewünschte Aktion kann nicht ausgeführt werden. Bitte wenden Sie sich an Ihren Administrator, um die gewünschte Aktion auszuführen.;Den aktuella konfigurationsmodellen är låst och den önskade åtgärden kan inte utföras. Kontakta din systemadministratör om du vill utföra den önskade åtgärden.;Bieżący model konfiguracji jest zablokowany i nie można wykonać żądanej akcji. Skontaktuj się z administratorem systemu, jeśli chcesz wykonać żądaną akcję.;Den gjeldende konfigurasjonsmodellen er låst, og den ønskede handlingen kan ikke utføres. Kontakt systemansvarlig hvis du vil utføre den ønskede handlingen.;El modelo de configuración actual está bloqueado y no se puede ejecutar la acción deseada. Póngase en contacto con el administrador de su sistema si desea ejecutar la acción deseada.;Il modello di configurazione attuale è bloccato e l'azione desiderata non può essere eseguita. Si prega di contattare l'amministratore di sistema se si desidera eseguire l'azione desiderata.;O modelo de configuração atual está bloqueado e a ação desejada não pode ser executada. Entre em contato com o administrador do sistema se desejar executar a ação desejada.;Pašreizējais konfigurācijas modelis ir bloķēts, un vēlamo darbību nevar izpildīt. Lūdzu, sazinieties ar sistēmas administratoru, ja vēlaties izpildīt vēlamo darbību.;Dabartinis konfigūracijos modelis yra užrakintas ir norimo veiksmo negalima vykdyti. Jei norite vykdyti norimą veiksmą, susisiekite su savo sistemos administratoriumi.
There already exists a step image in this configuration model which is set as the configuration image. Would you like to change it to this step?;Er is al een afbeelding van een stap ingesteld als configuratieafbeelding in dit model. Wil je het vervangen door deze afbeelding?;Il existe déjà une image d'étape dans ce modèle de configuration qui est définie comme image de configuration. Voulez-vous la changer pour cette étape ?;In diesem Modell ist bereits eine Abbildung einer Stufe als Konfigurationsbild eingestellt. Möchten Sie es durch diese Abbildung ersetzen?;Det finns redan en stegbild i den här konfigurationsmodellen som är inställd som konfigurationsbild. Vill du ändra den till det här steget?;W tym modelu konfiguracji istnieje już obraz kroku, który jest ustawiony jako obraz konfiguracji. Czy chcesz zmienić go na ten krok?;Det finnes allerede et stegbilde i denne konfigurasjonsmodellen som er angitt som konfigurasjonsbilde. Vil du endre det til dette stegbildet?;Ya existe una imagen de paso en este modelo de configuración que se establece como la imagen de configuración. ¿Te gustaría cambiarlo a este paso?;Esiste già un'immagine di passaggio in questo modello di configurazione che è impostata come immagine di configurazione. Desideri cambiarla con questo passaggio?;Já existe uma imagem de etapa neste modelo de configuração que está definida como imagem de configuração. Você gostaria de mudar para esta etapa?;Šajā konfigurācijas modelī jau pastāv soļa attēls, kas ir iestatīts kā konfigurācijas attēls. Vai vēlaties to mainīt uz šo soli?;Šiame konfigūracijos modelyje jau yra žingsnio vaizdas, kuris nustatomas kaip konfigūracijos vaizdas. Ar norėtumėte tai pakeisti į šį žingsnį?
Change configuration image?;Configuratieafbeelding wijzigen?;Modifier l'image de configuration ?;Konfigurationsbild ändern?;Ändra konfigurationsbild?;Zmienić zdjęcie konfiguracji?;Endre konfigurasjonsbilde?;¿Cambiar imagen de configuración?;Cambia immagine di configurazione?;Alterar imagem de configuração?;Mainīt konfigurācijas attēlu?;Keisti konfigūracijos vaizdą?
Use step image as configuration image on document;Afbeelding van deze stap als configuratieafbeelding in het document gebruiken;Utiliser l'image d'étape comme image de configuration sur le document;Verwenden Sie die Abbildung dieses Schrittes als Konfigurationsbild im Dokument;Använd stegbild som konfigurationsbild i dokumentet;Użyj obrazu kroku jako obrazu konfiguracji w dokumencie;Bruke stegbilde som konfigurasjonsbilde på dokument;Usar imagen de paso como imagen de configuración en el documento;Utilizza l'immagine di passaggio come immagine di configurazione sul documento;Use a imagem da etapa como imagem de configuração no documento;Dokumentā izmantojiet soļa attēlu kā konfigurācijas attēlu;Naudokite žingsnio vaizdą kaip konfigūracijos vaizdą dokumente
Confirm;Bevestigen;Confirmer;Bestätigen;Bekräfta;;Bekreft;Confirmar;Conferma;confirme;Apstiprināt;Patvirtinti
Are you sure you want to delete this unit of measurement? It currently is assigned to;Weet je zeker dat je deze meeteenheid wilt verwijderen? Deze is momenteel gekoppeld aan;Êtes-vous sûr de vouloir supprimer cette unité de mesure ? Elle est actuellement attribuée à;Sind Sie sicher, dass Sie diese Maßeinheit löschen wollen? Sie ist derzeit verlinkt mit;Är du säker på att du vill radera mätningsenheten? Den är för närvarande tilldelad till;Czy na pewno chcesz usunąć tę jednostkę miary? Obecnie jest przypisany do;Er du sikker på at du vil slette denne måleenheten? Den er for øyeblikket tilordnet til;¿Está seguro de que desea eliminar esta unidad de medida? Actualmente está asignado a;Sei sicuro di voler eliminare questa unità di misura? Attualmente è assegnata a;Tem certeza de que deseja excluir esta unidade de medida? Atualmente está atribuído a;Vai esat pārliecināts, ka vēlaties izdzēst šo mērīšanas vienību? Pašlaik tas ir piešķirts;Ar tikrai norite ištrinti šį matavimo vienetą? Šiuo metu jis priskiriamas
Showroom overview;Showroom overzicht;"Aperçu de la """"Showroom""""";Showroom Übersicht;Översikt över showroom;Przegląd showroom;Oversikt over showroom;Descripción general de la sala de exposición;Panoramica del salone;Visão geral do showroom;Izstāžu zāles pārskats;Salono apžvalga
View image;Afbeelding bekijken;Voir l'image;Abbildung anzeigen;Visa bild;Zobacz zdjęcie;Vis bilde;Ver imagen;Visualizza immagine;Ver imagem;Skata attēls;Peržiūrėti Nuotrauka
Show all;Alles tonen;Tout afficher;Alles anzeigen;Visa alla;Pokaż wszystko;Vis alt;Mostrar todo;Mostra tutto;Mostre tudo;Parādīt visu;Rodyti viską
