en;nl;fr;de;sv;pl;no;es;it;pt;lv;lt
Convert 3D Mapping to Nodes;3D Mapping converteren naar Nodes;Convertir le mappage 3D en nœuds;3D Mapping in Nodes umwandeln;Konvertera 3D-mappning till noder;Konwertuj mapowanie 3D do kart;Konvertere 3D-mapping til noder;Convertir mapeo 3D en nodos;Converti la mappatura 3D in Nodi;Converter mapeamento 3D em nós;Konvertēt 3D kartēšanu uz mezgliem;Konvertuoti 3D žemėlapį į mazgus
Remove 3D Mapping from Nodes;3D Mapping van Nodes verwijderen;Supprimer le mappage 3D des nœuds;3D Mapping von Nodes entfernen;Ta bort 3D-mappning från noder;Usuń mapowanie 3D z kart;Fjerne 3D-tilordning fra noder;Eliminar el mapeo 3D de los nodos;Rimuovi la mappatura 3D dai Nodi;Remover mapeamento 3D dos nós;Noņemiet 3D kartēšanu no mezgliem;Pašalinkite 3D žemėlapius iš mazgų
Total assigned 3D objects to Features:;Aantal 3D-objecten toegewezen aan Features:;Total des objets 3D attribués aux caractéristiques :;Anzahl der zugewiesenen 3D-Objekte zu Features:;Totalt tilldelade 3D-objekt till funktioner:;Łączna ilość przypisanych obiektów 3D do elementów:;Totalt antall tilordnede 3D-objekter til funksjoner:;Total de objetos 3D asignados a Características:;Totale oggetti 3D assegnati alle Caratteristiche:;Total de objetos 3D atribuídos aos recursos:;Kopā piešķirtie 3D objekti funkcijām:;Iš viso priskirtų 3D objektus funkcijoms:
Total assigned 3D objects to Nodes:;Aantal 3D-objecten toegewezen aan Nodes:;Total des objets 3D assignés aux nœuds :;Anzahl der zugewiesenen 3D-Objekte zu Nodes:;Totalt antal 3D-objekt som fördelats till noder:;Łączna ilość przypisanych obiektów 3D do kart:;Total assigned 3D objects to Nodes:;Total de objetos 3D asignados a Nodos:;Totale oggetti 3D assegnati ai Nodi:;Total de objetos 3D atribuídos aos nós:;Kopā piešķirtie 3D objekti mezgliem:;Iš viso priskirti 3D objektai mazgams:
Current:;Huidig:;Actuel :;Aktuell:;Nuvarande:;Aktualny:;N?rende:;Actual:;Attuale:;Atual:;Pašreizējais:;Dabartinis:
CoC number;KvK nummer;Numéro de la Chambre de commerce;Handelskammer Nummer;CoC-nummer;Numer REGON;CoC-nummer;número de CC;numero della camera di commercio;Número do CoC;COC numurs;COC numeris
Undo your last action by:;Herstel je laatste actie door:;Annulez votre dernière action en :;Stellen Sie Ihre letzte Aktion wieder her, indem Sie:;Ångra din senaste åtgärd genom att:;Cofnij ostatnią czynność, wykonując następujące czynności:;Angre den siste handlingen ved ?;Deshacer su última acción por:;Annullare l'ultima azione effettuata:;Desfaça sua última ação:;Atsaukt savu pēdējo darbību:;Atjunkite savo paskutinį veiksmą atlikdami:
1. Deselecting the Feature you selected last.;1. De feature die je als laatste hebt geselecteerd, te deselecteren.;1. Désélectionnant l'élément que vous avez sélectionné en dernier.;1. Das zuletzt ausgewählte Feature abwählen.;1. Ta bort valet av den funktion som du valde sist.;1. Usuń zaznaczenie ostatnio wybranego elementu;1. Fjern markeringen for funksjonen du valgte sist.;1. Anular la selección de la última función que seleccionó.;1. Deselezionando la funzione selezionata per ultima.;1. Desmarcando o recurso selecionado por último.;1. Noņemiet atlases funkciju, kuru izvēlējāties pēdējā.;1. Nusiminkite pasirinktą funkciją paskutinį kartą.
2. Selecting an alternative to the Feature you selected last.;2. Een alternatief voor de feature die je als laatste hebt geselecteerd, te kiezen.;2. En sélectionnant une autre fonction que celle que vous avez sélectionnée en dernier.;2. Ein alternatives Feature zum zuletzt ausgewählten Feature auswählen.;2. Välja ett alternativ till den funktion du valde sist.;2. Wybierz alternatywny element dla ostatniego wybranego elementu;2. Velge et alternativ til funksjonen du valgte sist.;2. Seleccionar una alternativa a la función que seleccionó en último lugar.;2. Selezionando un'alternativa alla funzione selezionata per ultima.;2. Selecionando uma alternativa para o Recurso selecionado por último.;2. Alternatīva izvēlētajai funkcijai, kuru izvēlējāties pēdējā.;2. Pasirinkti alternatyvą jūsų pasirinktai funkcijai paskutinį kartą.
This could be caused by a change in the parent configuration.;Dit kan worden veroorzaakt door een wijziging in de Parent configuratie.;Cela peut être dû à une modification de la configuration parentale.;Dies kann durch eine Änderung in der Parent-Konfiguration verursacht werden.;Detta kan orsakas av en ändring i den överordnade konfigurationen.;Może to być spowodowane zmianą konfiguracji nadrzędnej.;Dette kan skyldes en endring i den overordnede konfigurasjonen.;Esto podría deberse a un cambio en la configuración principal.;Questo potrebbe essere causato da una modifica della configurazione del genitore.;Isso pode ser causado por uma alteração na configuração pai.;To varētu izraisīt izmaiņas vecāku konfigurācijā.;Tai gali sukelti pirminės konfigūracijos pasikeitimas.
You are pasting a root node. You must choose a relationship type for this node.;Omdat je een root node plakt, moet je er een relatietype voor kiezen.;Vous collez un nœud racine. Vous devez choisir un type de relation pour ce nœud.;Da es sich um eine Root Node handelt, müssen Sie einen Beziehungstyp auswählen.;Du klistrar in en rotnod. Du måste välja en relationstyp för den här noden.;Wklejasz kartę główną. Należy wybrać typ relacji dla tej karty.;Du limer inn en rotnode. Du m?elge en relasjonstype for denne noden.;Está pegando un nodo raíz. Debe elegir un tipo de relación para este nodo.;Si sta incollando un nodo radice. È necessario scegliere un tipo di relazione per questo nodo.;Você está colando um nó raiz. Você deve escolher um tipo de relacionamento para este nó.;Jūs ielīmējat saknes mezglu. Šim mezglam jāizvēlas attiecību veids.;Jūs įklijuojate šaknies mazgą. Turite pasirinkti šio mazgo santykių tipą.
Paste operation has been cancelled.;Plakken is geannuleerd.;L'opération de collage a été annulée.;Einfügen wurde abgebrochen.;Inklistringsoperationen har avbrutits.;Operacja wklejania została anulowana.;Innlimingen er avbrutt.;Se ha cancelado la operación de pegado.;L'operazione di incollaggio è stata annullata.;A operação de colagem foi cancelada.;Paste darbība ir atcelta.;Įklijavimo operacija buvo atšaukta.
Retrieving Linked Models for Hierarchy...;Ophalen van Linked Models voor hiërarchie;Récupération des modèles liés pour la hiérarchie...;Linked Models für Hierarchy abrufen...;Hämta länkade modeller för hierarki...;Pobieranie połączonych modeli dla hierarchii...;Henter koblede modeller for hierarki...;Recuperando modelos vinculados para jerarquía...;Recupero dei modelli collegati per la gerarchia...;Recuperando modelos vinculados para hierarquia...;Saistītu hierarhijas modeļu iegūšana ...;Susijusių hierarchijos modelių gavimas ...
Publishing all linked models?;Alle linked modellen publiceren?;Publier tous les modèles liés ?;Alle verlinkten Modelle veröffentlichen?;Publicera alla länkade modeller?;Publikować wszystkie powiązane modele?;Publisere alle koblede modeller?;¿Publicar todos los modelos vinculados?;Pubblicare tutti i modelli collegati?;Publicando todos os modelos vinculados?;Publicēt visus saistītos modeļus?;Paskelbiate visus susietus modelius?
Publishing all linked models...;Publiceer alle linked modellen...;Publier tous les modèles liés...;Alle verlinkten Modelle veröffentlichen...;Publicera alla länkade modeller...;Publikowanie wszystkich powiąznaych modeli...;Publisere alle koblede modeller ...;Publicando todos los modelos vinculados...;Pubblicare tutti i modelli collegati...;Publicando todos os modelos vinculados...;Visu saistīto modeļu publicēšana ...;Visų susietų modelių publikavimas ...
Unit Price;Stukprijs;Prix unitaire;Stückpreis;Pris per enhet;Cena jednostkowa;Enhetspris;Precio unitario;Prezzo unitario;Preço unitário;Vienības cena;Vieneto kaina
Unit price;Stukprijs;Prix unitaire;Stückpreis;Pris per enhet;Cena jednostkowa;Enhetspris;Precio unitario;Prezzo unitario;Preço unitário;Vienības cena;Vieneto kaina
will publish all linked models that haven't been released yet.;zal alle Linked Models publiceren die nog niet zijn gepubliceerd.;publiera tous les modèles liés qui n'ont pas encore été publiés.;wird alle Linked Models veröffentlichen, die noch nicht veröffentlicht wurden.;publicerar alla länkade modeller som inte har släppts ännu.;opublikuje wszystkie powiązane modele, które nie zostały jeszcze wypuszczone.;vil publisere alle koblede modeller som ikke er utgitt enn?;publicará todos los modelos vinculados que aún no se hayan lanzado.;pubblicherà tutti i modelli collegati che non sono ancora stati rilasciati.;publicará todos os modelos vinculados que ainda não foram lançados.;publicēs visus saistītos modeļus, kas vēl nav izlaisti.;Paskelbs visus susietus modelius, kurie dar nebuvo išleisti.
Are you sure you want to continue?;Weet je zeker dat je wilt doorgaan?;Êtes-vous sûr de vouloir continuer ?;Sind Sie sicher, dass Sie fortfahren möchten?;Är du säker på att du vill fortsätta?;Jesteś pewny/a, że chcesz kontynuować?;Er du sikker p?t du vil fortsette?;Estás seguro de que quieres continuar?;Siete sicuri di voler continuare?;Você tem certeza que quer continuar?;Vai esat pārliecināts, ka vēlaties turpināt?;Ar tikrai norite tęsti?
Please wait while your configuration model is being published.;Wacht even terwijl je configuratiemodel wordt gepubliceerd.;Veuillez patienter pendant que votre modèle de configuration est publié.;Bitte warten Sie, während Ihr Konfigurationsmodell veröffentlicht wird.;Vänta medan din konfigurationsmodell publiceras.;Proszę poczekaj na opublikowanie modelu konfiguracji.;Vent mens konfigurasjonsmodellen publiseres.;Espere mientras se publica su modelo de configuración.;Attendere mentre il modello di configurazione viene pubblicato.;Aguarde enquanto seu modelo de configuração é publicado.;Lūdzu, pagaidiet, kamēr tiek publicēts konfigurācijas modelis.;Palaukite, kol bus paskelbtas jūsų konfigūracijos modelis.
Publishing Linked configuration models;Linked Models publiceren;Publication de modèles de configuration liés;Linked Models veröffentlichen;Publicera länkade konfigurationsmodeller;Publikowanie powiąznaych modeli konfiguracji;Publisere koblede konfigurasjonsmodeller;Publicación de modelos de configuración vinculados;Pubblicazione dei modelli di configurazione collegati;Publicação de modelos de configuração vinculados;Saistītu konfigurācijas modeļu publicēšana;Leidiniai susieti konfigūracijos modeliai
Your current configuration model contains linked models.;Je actuele configuratiemodel bevat Linked Models.;Votre modèle de configuration actuel contient des modèles liés.;Ihr aktuelles Konfigurationsmodell enthält Linked Models.;Din nuvarande konfigurationsmodell innehåller länkade modeller.;Bieżący model konfiguracji zawiera modele połączone.;Den gjeldende konfigurasjonsmodellen inneholder koblede modeller.;Su modelo de configuración actual contiene modelos vinculados.;Il modello di configurazione attuale contiene modelli collegati.;Seu modelo de configuração atual contém modelos vinculados.;Jūsu pašreizējā konfigurācijas modelī ir saistīti modeļi.;Dabartiniame konfigūracijos modelyje yra susieti modeliai.
If a linked model is never been published as production, it will get errors in the Order Entry or showroom.;Als een Linked Model nog nooit gepubliceerd is naar Productie, zal het fouten veroorzaken in de Order Entry of Showroom.;Si un modèle lié n'a jamais été publié en tant que production, des erreurs apparaîtront dans l'entrée de commande ou le showroom.;Wenn ein Linked Model noch nie in der Produktion veröffentlicht wurde, verursacht es Fehler im Order Entry oder Showroom.;Om en länkad modell aldrig har publicerats som produktion kommer den att få fel i orderingången eller showroomet.;Jeśli powiązany model nigdy nie zostanie opublikowany jako produkcja, będzie on zawierał błędy we wprowadzeniu zamówienia lub showroom.;Hvis en koblet modell aldri blir publisert som produksjon, vil den f?eil i ordreregistreringen eller showroomet.;Si un modelo vinculado nunca se publica como producción, obtendrá errores en la entrada de pedidos o en la sala de exposición.;Se un modello collegato non è mai stato pubblicato come produzione, si otterranno errori nell'Order Entry o nello showroom.;Se um modelo vinculado nunca for publicado como produção, ocorrerá erros na entrada do pedido ou no showroom.;Ja saistītais modelis nekad netiek publicēts kā ražošana, tas saņems kļūdas pasūtījuma ierakstā vai izstāžu zālē.;Jei susietas modelis niekada nebus paskelbtas kaip gamyba, jis gaus klaidas užsakymo įraše ar parodų salėje.
Please check if all linked models are published.;Controleer of alle Linked Models gepubliceerd zijn.;Veuillez vérifier si tous les modèles liés sont publiés.;Bitte prüfen Sie, ob alle Linked Models veröffentlicht sind.;Kontrollera om alla länkade modeller är publicerade.;Proszę sprawdź, czy wszystkie powiązane modele są opublikowane.;Sjekk om alle koblede modeller er publisert.;Compruebe si todos los modelos vinculados están publicados.;Verificare che tutti i modelli collegati siano stati pubblicati.;Verifique se todos os modelos vinculados estão publicados.;Lūdzu, pārbaudiet, vai visi saistītie modeļi tiek publicēti.;Patikrinkite, ar skelbiami visi susieti modeliai.
Linked Model hierarchy of;Linked Model hiërarchie van;Hiérarchie des modèles liés;Linked Model Hierarchie von;Kopplad modellhierarki av;Połączona hierarchia modeli;Hierarkiet for den koblede modellen for;Modelo vinculado jerarquía de;Gerarchia dei modelli collegati;Hierarquia do modelo vinculado de;Saistītā modeļa hierarhija;Susieta modelio hierarchija
Last Published;gepubliceerd op;Dernière publication;veröffentlicht am;Senast publicerad;Ostatnio opublikowane;Sist publisert;Última publicación;Ultimo pubblicato;Última publicação;Pēdējo reizi publicēts;Paskutinį kartą paskelbta
Never published;Niet gepubliceerd;Jamais publié;Nie veröffentlicht;Aldrig publicerad;Nigdy niepublikowane;Aldri publisert;Nunca publicado;Mai pubblicato;Nunca publicado;Nekad nav publicēts;Niekada nebuvo paskelbta
This linked model doesn't have any published versions in Production and it will cause errors in the Order Entry or showroom.;Dit Linked Model heeft geen gepubliceerde versies in de Productie, wat fouten zal veroorzaken in de Order Entry of Showroom.;Ce modèle lié n'a pas de version publiée en Production et il provoquera des erreurs dans l'entrée des commandes ou le showroom.;Dieses Linked Model hat keine veröffentlichten Versionen in der Produktion, was Fehler im Order Entry oder im Showroom verursachen wird.;Den här länkade modellen har inga publicerade versioner i produktion och det kommer att uppstå fel i orderingången eller showroomet.;Ten powiązany model nie ma żadnych opublikowanych wersji w Produkcji i spowoduje błędy we wprowadzaniu zamówienia lub showroom.;Denne koblede modellen har ingen publiserte versjoner i produksjonen, og det vil føre til feil i ordreregistreringen eller showroomet.;Este modelo vinculado no tiene versiones publicadas en Producción y provocará errores en la entrada de pedidos o showroom.;Questo modello collegato non ha versioni pubblicate in produzione e causerà errori nell'Order Entry o nello showroom.;Este modelo vinculado não possui versões publicadas em Produção e causará erros no Lançamento de Pedidos ou showroom.;Šim saistītajam modelim nav publicētu versiju ražošanā, un tas radīs kļūdas pasūtījuma ierakstā vai izstāžu zālē.;Šis susietas modelis neturi jokių paskelbtų gamybos versijų ir jis sukels klaidas užsakymo įraše ar parodų salėje.
This linked model does have published versions in Production, but the latest version is not in Production.;Dit Linked Model heeft gepubliceerde versies in de Productie, maar de nieuwste versie is nog niet in de Productie.;Ce modèle lié a des versions publiées en production, mais la dernière version n'est pas en production.;Dieses Linked Model hat veröffentlichte Versionen in der Produktion, aber die neueste Version ist noch nicht in der Produktion.;Den här länkade modellen har publicerade versioner i produktionen, men den senaste versionen finns inte i produktionen.;Ten połączony model ma opublikowane wersje w Produkcja, ale najnowsza wersja nie znajduje się w Produkcji.;Denne koblede modellen har publiserte versjoner i Produksjon, men den nyeste versjonen er ikke i Produksjon.;Este modelo vinculado tiene versiones publicadas en Producción, pero la última versión no está en Producción.;Questo modello collegato ha versioni pubblicate in produzione, ma l'ultima versione non è in produzione.;Este modelo vinculado possui versões publicadas em Produção, mas a versão mais recente não está em Produção.;Šis saistītais modelis ir publicējis versijas ražošanā, bet jaunākā versija nav ražota.;Šis susietas modelis iš tikrųjų paskelbė gamybos versijas, tačiau naujausia versija nėra gamyba.
This linked model does have published versions in Production and the latest version is in Production.;Dit Linked Model heeft gepubliceerde versies in de Productie en de nieuwste versie is momenteel in de Productie.;Ce modèle lié a des versions publiées en production et la dernière version est en production.;Dieses Linked Model hat veröffentlichte Versionen in der Produktion und die neueste Version ist derzeit in der Produktion.;Den här länkade modellen har publicerade versioner i produktionen och den senaste versionen finns i produktionen.;Ten połączony model ma opublikowane wersje w Produkcji, a najnowsza wersja jest w Produkcji.;Denne koblede modellen har publiserte versjoner i produksjon, og den nyeste versjonen er i produksjon.;Este modelo vinculado tiene versiones publicadas en producción y la última versión está en producción.;Questo modello collegato ha versioni pubblicate in produzione e l'ultima versione è in produzione.;Este modelo vinculado possui versões publicadas em Produção e a versão mais recente está em Produção.;Šis saistītais modelis ir publicējis ražošanas versijas, un jaunākā versija tiek ražota.;Šis susietas modelis iš tikrųjų paskelbė gamybos versijas, o naujausia versija yra gaminama.
Combine into quotation group;Combineren in offertegroep;;Als Angebotsgruppe zusammenfassen;;;Kombinere i tilbudsgruppe;Combinar en un grupo de ofertas;Combina in un gruppo di preventivi;Combinar em grupo de cotação;Apvienojiet piedāvājumu piedāvājumu grupā;Sujunkite pasiūlymą į pasiūlymo grupę
This combines all instances of this linked model into the parent quotation group.;Dit combineert alle instanties van dit Linked Model in de parent Offertegroep.;;Dadurch werden alle Instanzen dieses Linked Models in der Parent-Angebotsgruppe zusammengefasst.;;;;Esto combina todas las instancias de este modelo vinculado en el grupo de citas padre.;Consente di combinare tutte le istanze di questo modello collegato nel gruppo di quotazione padre.;Isso combina todas as instâncias deste modelo vinculado no grupo de cotação pai.;Tas apvieno visus šī saistītā modeļa gadījumus vecāku piedāvājuma grupā.;Tai sujungia visus šio susieto modelio pavyzdžius į tėvų pasiūlymų grupę.
The multiplier can not be used in combination with the combine into quotation group option.;"De ""Quotation group multiplier"" kan niet worden gebruikt in combinatie met de optie ""Combineren in offertegroep"".";;"Der ""Quotation group multiplier"" kann nicht in Kombination mit der Option ""Als Angebotsgruppe zusammenfassen"" verwendet werden.";;;Multiplikatoren kan ikke brukes kombinert med et tilbud med en alternativ gruppe.;El multiplicador no puede utilizarse en combinación con la opción combinar en grupo de cotización.;Il moltiplicatore non può essere usato in combinazione con l'opzione Combina in gruppo di preventivi.;O multiplicador não pode ser usado em combinação com a opção combinar em grupo de cotação.;"""Reizinātāju nevar izmantot kopā ar opciju """"Apvienot piedāvājuma grupā"""".""";Daugiklis negali būti naudojamas kartu su parinktimi „Sujungti į pasiūlymo grupę“.
The combine into quotation group option can not be used in combination with the multiplier option.;"De optie ""Combineren in offertegroep"" kan niet worden gebruikt in combinatie met de ""Quotation group multiplier"".";;"Die Option ""Als Angebotsgruppe zusammenfassen"" kann nicht in Kombination mit dem ""Quotation group multiplier"" verwendet werden.";;;Škombinere dette inn i tilbudsgruppe kan ikke brukes i kombinasjon med multiplikatoralternativet.;La opción combinar en grupo de cotización no puede utilizarse en combinación con la opción multiplicador.;L'opzione Combina in gruppo di preventivi non può essere usata in combinazione con l'opzione Moltiplicatore.;A opção combinar em grupo de cotação não pode ser usada em combinação com a opção multiplicador.;Apvienoto grupu apvienošanu nevar izmantot kombinācijā ar reizinātāja opciju.;„Derinio į pasiūlymo grupės“ parinktį negalima naudoti kartu su daugiklio parinktimi.
All of the steps are hidden in the;Alle stappen zijn verborgen in de;;Alle Schritte verbergen im;;;Alle trinnene er skjult i;Todos los pasos están ocultos en el;Tutti i passaggi sono nascosti nella finestra;Todas as etapas estão ocultas no;Visas darbības ir paslēptas;Visi veiksmai yra paslėpti
the;de;;der;;;omr?t;el;il;o;līdz;
Click or drag a 3D model file to this area to upload;Drag and drop een 3D-modelbestand naar dit gebied om te uploaden, of klik om een bestand te selecteren.;;Um ein 3D-Modell hochzuladen, ziehen Sie es in diesen Bereich, oder wählen Sie eine Datei aus.;;;Klikk eller dra en 3D-modellfil til dette omr?t for ?aste den opp.;Haga clic o arrastre un archivo de modelo 3D a esta área para cargarlo;Fare clic o trascinare un file di modello 3D in quest'area per caricarlo.;Clique ou arraste um arquivo de modelo 3D para esta área para fazer upload;Noklikšķiniet vai velciet 3D modeļa failu uz šo apgabalu, lai augšupielādētu;Norėdami įkelti, spustelėkite arba vilkite 3D modelio failą į šią sritį
Maximum file size:;Maximale bestandsgrootte:;;Maximale Dateigröße:;;;Maksimal filstørrelse:;Tamaño máximo del archivo:;Dimensione massima del file:;Tamanho máximo do arquivo:;Maksimālais faila lielums:;Maksimalus failo dydis:
Supported file extensions:;Ondersteunde bestandsextensies:;;Unterstützte Dateiformate:;;;Filutvidelser som støttes:;Extensiones de archivo compatibles:;Estensioni di file supportate:;Extensões de arquivo suportadas:;Atbalstītie failu paplašinājumi:;Palaikomi failų plėtiniai:
Manage table preferences;Beheer tabeleigenschappen;Gérer les préférences de la table;Tabellenpräferenzen verwalten;Hantera tabellinställningar;Zarządzaj preferencjami tabeli;Administrer tabellinnstillinger;Gestionar las preferencias de las mesas;Gestione delle preferenze della tabella;Gerenciar preferências de tabela;Pārvaldiet tabulas preferences;Tvarkykite lentelės nuostatas
Manage table;Beheer tabel;Gérer la table;Tabelle verwalten;Hantera tabell;Zarządzaj tabelą;Administrer tabell;Gestionar mesa;Gestire la tabella;Gerenciar tabela;Pārvaldīt tabulu;Tvarkykite lentelę
Enable overview page;Overzichtspagina inschakelen;;Übersichtsseite einschalten;;;;Activar la página de resumen;Abilita la pagina di riepilogo;Ativar página de visão geral;Iespējot pārskata lapu;Įgalinkite apžvalgos puslapį
Adds an overview page which users will see before going to the checkout page.;Voegt een overzichtspagina toe die gebruikers te zien krijgen voordat ze naar de checkout gaan.;;Fügt eine Übersicht hinzu, die die Benutzer sehen, bevor sie zum Checkout gehen.;;;;Añade una página de resumen que los usuarios verán antes de ir a la página de pago.;Aggiunge una pagina di riepilogo che gli utenti vedranno prima di passare alla pagina di pagamento.;Adiciona uma página de visão geral que os usuários verão antes de ir para a página de checkout.;Pievieno pārskata lapu, kuru lietotāji redzēs pirms došanās uz kases lapu.;Pridėkite apžvalgos puslapį, kurį vartotojai pamatys prieš eidami į kasos puslapį.
Input field;Invoerveld;;Eingabefeld;;;;Campo de entrada;Campo di inserimento;Campo de entrada;Ievades lauks;Įvesties laukas
